{
  "version": "1.0.0",
  "name": "base.mist",
  "dimension": "base",
  "light": {
    "background": "white",
    "foreground": "mist.950",
    "card": "white",
    "cardForeground": "mist.950",
    "popover": "white",
    "popoverForeground": "mist.950",
    "muted": "mist.100",
    "mutedForeground": "mist.500",
    "accent": "mist.100",
    "accentForeground": "mist.900"
  },
  "dark": {
    "background": "mist.950",
    "foreground": "mist.50",
    "card": "mist.900",
    "cardForeground": "mist.50",
    "popover": "mist.900",
    "popoverForeground": "mist.50",
    "muted": "mist.800",
    "mutedForeground": "mist.400",
    "accent": "mist.800",
    "accentForeground": "mist.50"
  }
}
