{
  "version": "1.0.0",
  "name": "base.mauve",
  "dimension": "base",
  "light": {
    "background": "white",
    "foreground": "mauve.950",
    "card": "white",
    "cardForeground": "mauve.950",
    "popover": "white",
    "popoverForeground": "mauve.950",
    "muted": "mauve.100",
    "mutedForeground": "mauve.500",
    "accent": "mauve.100",
    "accentForeground": "mauve.900"
  },
  "dark": {
    "background": "mauve.950",
    "foreground": "mauve.50",
    "card": "mauve.900",
    "cardForeground": "mauve.50",
    "popover": "mauve.900",
    "popoverForeground": "mauve.50",
    "muted": "mauve.800",
    "mutedForeground": "mauve.400",
    "accent": "mauve.800",
    "accentForeground": "mauve.50"
  }
}
