{
  "version": "1.0.0",
  "name": "base.gray",
  "dimension": "base",
  "light": {
    "background": "white",
    "foreground": "gray.950",
    "card": "white",
    "cardForeground": "gray.950",
    "popover": "white",
    "popoverForeground": "gray.950",
    "muted": "gray.100",
    "mutedForeground": "gray.500",
    "accent": "gray.100",
    "accentForeground": "gray.900"
  },
  "dark": {
    "background": "gray.950",
    "foreground": "gray.50",
    "card": "gray.900",
    "cardForeground": "gray.50",
    "popover": "gray.900",
    "popoverForeground": "gray.50",
    "muted": "gray.800",
    "mutedForeground": "gray.400",
    "accent": "gray.800",
    "accentForeground": "gray.50"
  }
}
